{
  "schema": "math-commons-formalization-intake/v1",
  "updated": "2026-08-22",
  "repository": "https://github.com/KokunoYumeto/mathematics-commons-pilot",
  "status": "scaffold",
  "summary": {
    "sources": 3,
    "items": 19,
    "runnable_packets": 0,
    "build_replay_pass_sources": 2,
    "placeholder_scan_clean_sources": 1,
    "statement_reviews_complete": 0,
    "mathlib_audits_complete": 0
  },
  "sources": [
    {
      "id": "lean-theorems-1-6cf9ce4",
      "kind": "git_repository",
      "title": "Formalization of Open Combinatorial and Geometric Theorems in Lean 4",
      "url": "https://github.com/sneed-and-feed/lean-theorems-1",
      "snapshot": {
        "state": "inventoried",
        "revision": "6cf9ce44c1a8281699fa2f3128a764e0c347e7f6",
        "commit": "6cf9ce44c1a8281699fa2f3128a764e0c347e7f6",
        "tree": "eee97092915b388bf4b30bcdf60c5ad2201af133",
        "doi": null,
        "concept_doi": null,
        "version": null,
        "publication_date": null
      },
      "rights": {
        "state": "license_file_checked",
        "license": "CC0-1.0",
        "evidence": "https://github.com/sneed-and-feed/lean-theorems-1/blob/6cf9ce44c1a8281699fa2f3128a764e0c347e7f6/LICENSE"
      },
      "inventory": {
        "files": 36,
        "bytes": 592129,
        "lean_files": 30,
        "archive": {
          "name": "lean-theorems-1-6cf9ce44.zip",
          "url": "https://github.com/sneed-and-feed/lean-theorems-1/archive/6cf9ce44c1a8281699fa2f3128a764e0c347e7f6.zip",
          "bytes": 153841,
          "sha256": "5C4A6C275524D96AA955640959C423FAD9DD81DCAC00DCE4ABF91CAEBCA51BE9",
          "member_files": 36,
          "member_bytes": 592129,
          "replay": {
            "verified_files": 36,
            "advertised_files": 36,
            "excluded_members": []
          }
        }
      },
      "toolchain": {
        "lean": "leanprover/lean4:v4.34.0-rc1",
        "mathlib_commit": "20bc12820422504f9e52ee6caebf8182a9015336",
        "other_pins": [
          "plausible 38e9c3ce15cbb63c92e90bb9a92e4eb82131f669",
          "LeanSearchClient 2bc7cf064315b26bc38dac2e9612fb581be9b75f",
          "importGraph 978b7ec9fbbf9a535114f1de8fe5b3778b358870",
          "proofwidgets ebeca04ecd5ee2ba9740e13576d80d4ab6b5779c",
          "aesop c1c4362a130f12e632d252180a6c2a31d8fd4726",
          "Qq 3b55e9d00c6b0018e5d984eb011b6f93c09bd163",
          "batteries 36cc05ca2d0e469bfbeea9437f460e19238e885e",
          "Cli af8bc067a4cc6c6df472a68909a3f40b1c76c43e"
        ]
      },
      "build": {
        "state": "default_target_replay_pass",
        "scope": "default_targets",
        "compiled_files": 29,
        "total_lean_files": 30,
        "evidence_date": "2026-08-22",
        "commands": [
          {
            "command": "lake build",
            "exit_code": 0,
            "result": "pass"
          },
          {
            "command": "lake test",
            "exit_code": 1,
            "result": "no_test_driver"
          },
          {
            "command": "lake env lean Formalization/ColorfulHelly.lean",
            "exit_code": 1,
            "result": "fail"
          }
        ],
        "placeholders": {
          "status": "present",
          "count": 4,
          "scan_scope": "all_source_files",
          "scanned_files": 30,
          "occurrences": [
            {
              "path": "Formalization/DesarguesVector.lean",
              "line": 191,
              "token": "sorry"
            },
            {
              "path": "Formalization/ColorfulHelly.lean",
              "line": 187,
              "token": "sorry"
            },
            {
              "path": "Formalization/ErdosKoRado.lean",
              "line": 596,
              "token": "sorry"
            },
            {
              "path": "Formalization/ErdosKoRado.lean",
              "line": 617,
              "token": "sorry"
            }
          ]
        },
        "trust_markers": {
          "status": "none_found",
          "count": 0,
          "scan_scope": "all_source_files",
          "scanned_files": 30,
          "occurrences": []
        },
        "excluded_modules": [
          {
            "path": "Formalization/ColorfulHelly.lean",
            "reason": "The default library does not import this module. Targeted compilation fails on two out-of-scope identifiers and the module also contains sorry."
          }
        ],
        "notes": [
          "The default library build completed 3,099 jobs but emitted sorry warnings from imported modules.",
          "The direct source scan found no explicit axiom or unsafe declarations; this does not remove the standard Lean/Mathlib axioms reported by #print axioms.",
          "Build success proves Lean acceptance of the imported declarations, not statement correspondence or historical source fidelity.",
          "No test driver is configured, so lake test is not a mathematical failure but supplies no additional evidence."
        ]
      },
      "claims_audit": [
        {
          "claim": "The core build contains no sorry or incomplete goals.",
          "result": "contradicted",
          "evidence": "Four sorry tokens are present; three are in modules imported by the default library and one is in the unimported failing Colorful Helly module."
        },
        {
          "claim": "The repository supplies machine-checked formalizations for the theorem descriptions in its README.",
          "result": "qualified",
          "evidence": "Many named declarations compile, but several README descriptions are stronger than the corresponding declarations and some named declarations do not exist."
        }
      ],
      "limitations": [
        "This source is an external, fast-moving repository snapshot and is not a Mathlib acceptance record.",
        "Its successful build includes placeholders and does not establish that any formal statement matches the cited historical theorem.",
        "Every candidate below still needs an exact statement/source comparison and a pinned Mathlib gap audit."
      ]
    },
    {
      "id": "lean-theorems-1-4fce53c",
      "kind": "git_repository",
      "title": "Formalization of Open Combinatorial and Geometric Theorems in Lean 4 — current follow-up",
      "url": "https://github.com/sneed-and-feed/lean-theorems-1",
      "snapshot": {
        "state": "inventoried",
        "revision": "4fce53cf5e0be46bfc12e633e2a4924102f12bd8",
        "commit": "4fce53cf5e0be46bfc12e633e2a4924102f12bd8",
        "tree": "99c6732878a3f9ae34bc3bb607b5c202e824e59a",
        "doi": null,
        "concept_doi": null,
        "version": null,
        "publication_date": null
      },
      "rights": {
        "state": "license_file_checked",
        "license": "CC0-1.0",
        "evidence": "https://github.com/sneed-and-feed/lean-theorems-1/blob/4fce53cf5e0be46bfc12e633e2a4924102f12bd8/LICENSE"
      },
      "inventory": {
        "files": 36,
        "bytes": 635125,
        "lean_files": 30,
        "archive": {
          "name": "lean-theorems-1-4fce53cf.zip",
          "url": "https://github.com/sneed-and-feed/lean-theorems-1/archive/4fce53cf5e0be46bfc12e633e2a4924102f12bd8.zip",
          "bytes": 162915,
          "sha256": "1D770EFC0A8E6B4EB7B8C27FE37551F426ECF5636B7864C6F5152DDB9C1BA2B1",
          "member_files": 36,
          "member_bytes": 635125,
          "replay": {
            "verified_files": 36,
            "advertised_files": 36,
            "excluded_members": []
          }
        }
      },
      "toolchain": {
        "lean": "leanprover/lean4:v4.34.0-rc1",
        "mathlib_commit": "20bc12820422504f9e52ee6caebf8182a9015336",
        "other_pins": [
          "plausible 38e9c3ce15cbb63c92e90bb9a92e4eb82131f669",
          "LeanSearchClient 2bc7cf064315b26bc38dac2e9612fb581be9b75f",
          "importGraph 978b7ec9fbbf9a535114f1de8fe5b3778b358870",
          "proofwidgets ebeca04ecd5ee2ba9740e13576d80d4ab6b5779c",
          "aesop c1c4362a130f12e632d252180a6c2a31d8fd4726",
          "Qq 3b55e9d00c6b0018e5d984eb011b6f93c09bd163",
          "batteries 36cc05ca2d0e469bfbeea9437f460e19238e885e",
          "Cli af8bc067a4cc6c6df472a68909a3f40b1c76c43e"
        ]
      },
      "build": {
        "state": "not_run",
        "scope": "not_run",
        "compiled_files": 0,
        "total_lean_files": 30,
        "evidence_date": null,
        "commands": [],
        "placeholders": {
          "status": "present",
          "count": 6,
          "scan_scope": "all_source_files",
          "scanned_files": 30,
          "occurrences": [
            {
              "path": "Formalization/DesarguesVector.lean",
              "line": 191,
              "token": "sorry"
            },
            {
              "path": "Formalization/ColorfulHelly.lean",
              "line": 187,
              "token": "sorry"
            },
            {
              "path": "Formalization/ErdosKoRado.lean",
              "line": 596,
              "token": "sorry"
            },
            {
              "path": "Formalization/ErdosKoRado.lean",
              "line": 617,
              "token": "sorry"
            },
            {
              "path": "Formalization/ErdosSzekeresConvex.lean",
              "line": 1280,
              "token": "sorry"
            },
            {
              "path": "Formalization/TverbergsTheorem.lean",
              "line": 602,
              "token": "sorry"
            }
          ]
        },
        "trust_markers": {
          "status": "none_found",
          "count": 0,
          "scan_scope": "all_source_files",
          "scanned_files": 30,
          "occurrences": []
        },
        "excluded_modules": [
          {
            "path": "Formalization/ColorfulHelly.lean",
            "reason": "The default Formalization root does not import this module. No targeted compile was performed for this current snapshot."
          }
        ],